[
    {
        "id": "potion_minor_health",
        "name": "Potion of Minor Healing",
        "description": "A small red vial that restores a modest amount of health.",
        "type": "potion",
        "weight": 0.5,
        "baseValue": 15,
        "rarity": "common",
        "tags": [],
        "effect": "restore_health",
        "magnitude": 25,
        "duration": 0
    },
    {
        "id": "potion_minor_stamina",
        "name": "Potion of Minor Stamina",
        "description": "A green elixir that restores stamina.",
        "type": "potion",
        "weight": 0.5,
        "baseValue": 15,
        "rarity": "common",
        "tags": [],
        "effect": "restore_stamina",
        "magnitude": 25,
        "duration": 0
    },
    {
        "id": "potion_minor_magicka",
        "name": "Potion of Minor Magicka",
        "description": "A blue liquid that replenishes magicka.",
        "type": "potion",
        "weight": 0.5,
        "baseValue": 15,
        "rarity": "common",
        "tags": [],
        "effect": "restore_magicka",
        "magnitude": 25,
        "duration": 0
    },
    {
        "id": "potion_resist_fire",
        "name": "Potion of Fire Resistance",
        "description": "A shimmering orange potion that grants temporary fire resistance.",
        "type": "potion",
        "weight": 0.5,
        "baseValue": 50,
        "rarity": "uncommon",
        "tags": [],
        "effect": "resist_fire",
        "magnitude": 50,
        "duration": 60
    },
    {
        "id": "poison_damage",
        "name": "Frostbite Venom",
        "description": "A potent poison harvested from frostbite spiders. Apply to weapons for extra damage.",
        "type": "potion",
        "weight": 0.5,
        "baseValue": 30,
        "rarity": "uncommon",
        "tags": [],
        "effect": "damage_health",
        "magnitude": 15,
        "duration": 10
    },
    {
        "id": "tome_flames",
        "name": "Spell Tome: Flames",
        "description": "A worn leather-bound tome. The pages crackle with barely-contained heat. Reading it will teach you the Flames spell.",
        "type": "spell_tome",
        "weight": 1,
        "baseValue": 50,
        "rarity": "common",
        "tags": [],
        "spellId": "spell_flames"
    },
    {
        "id": "tome_healing",
        "name": "Spell Tome: Healing",
        "description": "A tome bound in white leather with gold leaf. Contains the Healing spell.",
        "type": "spell_tome",
        "weight": 1,
        "baseValue": 50,
        "rarity": "common",
        "tags": [],
        "spellId": "spell_healing"
    },
    {
        "id": "tome_frostbite",
        "name": "Spell Tome: Frostbite",
        "description": "An ice-cold tome. Frost crystals form on your fingers as you hold it. Teaches Frostbite.",
        "type": "spell_tome",
        "weight": 1,
        "baseValue": 50,
        "rarity": "common",
        "tags": [],
        "spellId": "spell_frostbite"
    },
    {
        "id": "bread",
        "name": "Bread",
        "description": "A simple loaf of bread. Not glamorous, but filling.",
        "type": "food",
        "weight": 0.5,
        "baseValue": 2,
        "rarity": "common",
        "tags": [],
        "healthRestore": 5,
        "staminaRestore": 5
    },
    {
        "id": "grilled_leek",
        "name": "Grilled Leek",
        "description": "A lightly charred leek, still warm from the fire.",
        "type": "food",
        "weight": 0.2,
        "baseValue": 3,
        "rarity": "common",
        "tags": [],
        "healthRestore": 3,
        "staminaRestore": 2
    }
]